text,sentiment,customer_intent,primary_aspect,aspect_flag
bad delivery man arrogant behaviour,0,0,3,behaviour
very good service delivered one day early,2,2,4,fallback_support
performance exceeded expectations,2,2,4,fallback_support
do not receive mail,0,0,4,fallback_support
your executive ask for aadhar card of receive person,1,1,4,fallback_support
not me,1,1,4,fallback_support
wrong product delivered ordered tshirts received pants,0,0,4,fallback_support
wrong article received only car mobile charger in box,0,0,4,fallback_support
delivery time not shown,1,1,4,fallback_support
want to return my order,1,1,7,refund
delivery delayed beyond promised date,0,0,0,delay
delivery delayed by one day,1,0,0,delay
very good behaviour nicely talk good hearted man,2,2,3,behaviour
provide delivery time slot option,1,1,4,fallback_support
called to delivery point instead of doorstep,0,0,4,support
name incorrect on parcel,1,1,4,fallback_support
delivered ahead of schedule very efficient service,2,2,4,fallback_support
thanks,2,2,4,fallback_support
delivery person cooperative,1,1,4,fallback_support
product original address per deliver nahi huva,0,0,4,fallback_support
employee explained account features very well and opened account after banking hours appreciate the effort,2,2,4,fallback_support
they wait for u because we late take delivery,1,0,0,delay
had to collect parcel from office pathetic service,0,0,4,fallback_support
delivery agent number not shared,0,0,4,fallback_support
false information raised by delivery partner,0,0,4,fallback_support
not receive parcel no call no OTP,0,0,3,behaviour
delivery staff not interested left parcel with security item missing,0,0,2,damage_lost
bank service excellent welcome kit pending,2,2,4,fallback_support
nice behaviour,1,2,3,behaviour
slow delivery extremely delayed,0,0,0,delay
status misleading parcel delivered late and tampered,0,0,2,damage_lost
sandip polite and cooperative delivery agent,2,2,4,fallback_support
ok tanq,1,1,4,fallback_support
parcel not delivered to me,1,0,4,fallback_support
delivery marked delivered without actual delivery,1,1,4,fallback_support
nice service overall,2,2,4,fallback_support
delivery marked without actual delivery,0,0,4,fallback_support
very bad saree quality,0,0,4,fallback_support
delivery late despite follow ups,1,0,0,delay
NONE,1,1,4,fallback_support
minimum balance info needed,1,1,4,fallback_support
delivery boy contact number should be shared,1,1,4,support
order is fake want to return very disappointed,0,0,7,refund
fake product exchange fraud,0,0,7,refund
bad service article reached hub near my house but not delivered,0,0,4,fallback_support
item not same,0,0,4,fallback_support
not right,1,1,4,fallback_support
very rude behaviour shouting and arguing with customer,0,0,3,behaviour
continuous delay no support or contact,0,0,0,delay
normal service,1,1,4,fallback_support
everything perfect service,2,2,4,fallback_support
track parcel go office collect it know they delay delivery,1,0,0,delay
fake product delivered unhappy,0,0,4,fallback_support
worst delivery personnel,0,0,4,fallback_support
bad service experience,0,0,4,fallback_support
delivery boy very humble,2,2,4,fallback_support
nothing to improve everything perfect,2,2,4,fallback_support
prompt fast delivery,2,2,4,fallback_support
not well,0,0,4,fallback_support
rude delivery person behaviour,0,0,3,behaviour
india,1,1,4,fallback_support
fake remark short address delivery not attempted,0,0,0,delay
no call just delivery message received,0,0,3,behaviour
best service in region,2,2,4,fallback_support
staff cooperative timely delivery,2,2,4,fallback_support
not good quality,0,0,4,fallback_support
delivery boy didnt speak address parcel not received,0,0,2,damage_lost
delivery on time good service thanks bluedart,2,2,4,fallback_support
delivery delayed repeatedly,0,0,0,delay
fjfuuffhhchf,1,1,4,fallback_support
delivered after delay extremely poor service,0,0,0,delay
regional language support needed for KYC,1,1,4,support
very good service keep it going,2,2,4,fallback_support
delivery agent not trained rude behaviour,0,0,3,behaviour
shipment not delivered but marked delivered,0,0,4,fallback_support
not receive parcel without handover,1,1,4,fallback_support
delivery agent professional and polite,2,2,4,fallback_support
10,1,1,4,fallback_support
missing item from package,1,0,2,damage_lost
delivery partner refused doorstep delivery asked to collect far away,0,0,4,fallback_support
My Documents not received Please Contact,1,1,2,damage_lost
parcel not delivered to address,0,0,4,fallback_support
parcel wrongly delivered not received by me,0,0,2,damage_lost
order not receive,1,1,4,fallback_support
delivery person good but unreachable in emergency,1,2,4,fallback_support
return requested wrong product,1,0,7,refund
not dor delivery,1,1,4,fallback_support
no home delivery,0,0,4,fallback_support
cloth quality very bad,0,0,4,fallback_support
want return my order because different item received,1,1,7,refund
delivery denied to home told service only on main road market area,0,0,4,fallback_support
product delivered to wrong person,0,0,1,wrong_delivery
delivery person knows address accurately,1,1,4,fallback_support
parcel delivered to tenant without otp,1,1,4,fallback_support
delivery of this order make promptly,1,1,4,fallback_support
delivery received accurately,1,1,4,fallback_support
replace cover wrong item,1,0,4,fallback_support
item delivered to wrong person,0,0,1,wrong_delivery
not deliver at door step,1,1,4,fallback_support
nothing more to say delivered on time,2,2,4,fallback_support
unprofessional delivery staff behaviour,1,1,3,behaviour
delivery delay,1,0,0,delay
delivery agent polite professional,1,1,4,fallback_support
product different from ur add,1,1,4,fallback_support
received,1,1,4,fallback_support
this my first order receive from blue dart,1,1,4,fallback_support
everything ok excellent service thanks,2,2,4,fallback_support
delivery office pickup required,1,1,4,fallback_support
mobile case exchange issue,1,0,7,refund
it not deliver me yet,1,1,4,fallback_support
delivery delayed missed important date,1,0,0,delay
shipment delivered on time,2,2,4,fallback_support
extra day taken for delivery,1,1,4,fallback_support
didnt receive any parcel fraud case,0,0,4,fallback_support
order delivered very late,0,0,0,delay
timely service,1,1,4,fallback_support
pathetic delivery had to collect from centre,0,0,4,fallback_support
good ok overall satisfied,2,2,4,fallback_support
delivery delayed with no update extremely disappointing,0,0,0,delay
package marked delivered but not received,0,0,2,damage_lost
Amazing experience,2,2,4,fallback_support
delivery very late but finally received,1,0,0,delay
not received yet,1,1,2,damage_lost
delivery done before schedule appreciable,2,2,4,fallback_support
delivery status wrongly marked delivered without call,0,0,5,tracking
update status regularly,1,1,4,fallback_support
delivery not attempted at location,1,1,0,delay
parcel not received no call,0,0,2,damage_lost
very patient well speak delivery guy v respectful helpful,2,2,4,fallback_support
order delivery delayed many days unprofessional behaviour,0,0,0,delay
self pickup required,1,1,4,fallback_support
people not reach at mentioned address atleast didnt get call from delivery agent when check status it mention a address invalid which deliver other shipment same address in past which clearly say that negligence of service finally step in office location get card,0,0,4,support
delivery lady behavior not good,0,0,3,behaviour
very poor had to collect parcel from office,0,0,4,fallback_support
broken box received,1,1,2,damage_lost
nice service experience,2,2,4,fallback_support
delivery not attempted had to collect from office,0,0,0,delay
parcel not delivered and no intimation provided,1,0,3,behaviour
not delivered to hand,1,0,4,fallback_support
delivery reattempt done thank you,2,2,4,fallback_support
parcel taken back by delivery person,1,1,4,fallback_support
delivery marked completed before actual delivery,1,1,4,fallback_support
do not receive package but marked delivered,0,0,4,fallback_support
product missing,0,0,2,damage_lost
order delivered but not upto mark,1,1,4,fallback_support
missing item in parcel,1,0,2,damage_lost
easy account opening good experience,2,2,4,fallback_support
delivery service very good and helpful staff,2,2,4,fallback_support
delivery delayed,0,0,0,delay
late delivery after many days,1,0,0,delay
delivery agent extremely rude,0,0,3,behaviour
delivery executive did great job,2,2,4,fallback_support
where my parcel,1,1,4,fallback_support
didnt receive my product,0,0,4,fallback_support
delivery not at residence unclear source,0,0,4,fallback_support
professional response improved,2,2,4,fallback_support
shipment delivery delayed,1,0,0,delay
hassle free,1,1,4,fallback_support
delivery man no wait rude,1,0,3,behaviour
bluedart forced self collection from office very bad service,0,0,4,fallback_support
courier not received,1,1,2,damage_lost
godo,1,1,4,fallback_support
gold,1,1,4,fallback_support
very poor delivery forced office pickup after week,0,0,4,fallback_support
fraud seller wrong product delivered despite correct invoice,0,0,4,fallback_support
bank documents handed without verification concern,1,1,4,fallback_support
box cut parcel tampered,0,0,2,damage_lost
havent receive my parcel,0,0,4,fallback_support
delivery person refused door delivery and asked me to travel long distance,0,0,4,fallback_support
size extremely small,1,1,4,fallback_support
awesome service,2,2,4,fallback_support
parcel received opened item missing delivery person refused responsibility,0,0,2,damage_lost
it deliver late keep get message daily that not at home but no one ever come deilver this unprofessional understand that there can genuine case of delay,0,0,0,delay
delivery delayed had to collect from office,0,0,0,delay
delivery guy do not deliver parcel just because he climb stair,0,0,4,fallback_support
noiceeeee,1,1,4,fallback_support
delivery partner very polite and professional,2,2,4,fallback_support
wrong size received,1,0,4,fallback_support
after day effect,1,1,4,fallback_support
delivery boy promised delivery but delayed,1,0,0,delay
delivery was too late compared to schedule,0,0,0,delay
poor delivery service overall,0,0,4,fallback_support
on time,1,1,4,fallback_support
one day late delivery,1,0,0,delay
false reporting without visit or call,0,0,4,support
item not received no delivery attempt,0,0,2,damage_lost
office jake lena pada service ekdam galat hai,0,0,4,fallback_support
confidential letter delivered to wrong person security risk,1,0,1,wrong_delivery
fantastic five star,2,2,4,fallback_support
ok good,2,2,4,fallback_support
delivery improvement required,1,1,4,fallback_support
satisfied with service,2,2,4,fallback_support
not delivered at my location,0,0,4,fallback_support
excellent fast service,2,2,4,fallback_support
delivery reached district but not delivered for days,0,0,4,fallback_support
very late delivery,0,0,0,delay
delivered to wrong person address,0,0,1,wrong_delivery
by my name correction required,1,1,4,fallback_support
product defective,0,0,4,fallback_support
delivery address marked incorrect falsely,0,0,4,fallback_support
punctuality,1,1,4,fallback_support
delivery not on time wrong info given,0,0,0,delay
no manner talk eldersneed improve interaction behaviour which cant insult client especially senior,0,0,3,behaviour
bad service delivery boy start call me from pm deliver at he call with different different number again again,0,0,4,support
delivery boy patience appreciated,2,2,4,fallback_support
delivery late no site update,0,0,0,delay
self pickup delivery failed,1,1,0,delay
very good service impressed,2,2,4,fallback_support
many times delivery avoided with false reasons no call made,0,0,3,behaviour
Nothing need to change,1,1,4,fallback_support
waited whole day no call delivery timing unclear,1,2,3,behaviour
product not delivered at all,0,0,4,fallback_support
delivery partner was very rude refused to come near doorstep and spoke harshly unacceptable behaviour,0,0,3,behaviour
delivery after full payment delayed,0,0,0,delay
package not delivered,1,0,4,fallback_support
it deliver at all whom deliver god only know,1,1,4,fallback_support
correct delivery,2,2,4,fallback_support
get different product not what ordered,1,1,4,fallback_support
delivery delay with false premise closed update very poor service,0,0,0,delay
shipment not delivered fake update,0,0,4,fallback_support
rude behaviour,0,0,3,behaviour
saree damaged,0,0,2,damage_lost
partial delivery app shows full delivered,1,1,4,fallback_support
product does not fit cannot use,0,0,4,fallback_support
good service communication easy,2,2,4,fallback_support
excellent customer service,2,2,4,support
ok receive,1,1,4,fallback_support
professional conduct,1,1,4,fallback_support
we cant receive flicka silk touch only lipstick receive from box,1,1,4,fallback_support
important courier delayed without call,0,0,0,delay
delivery guy didnt deliver order,0,0,4,fallback_support
u deliver wrong courier,0,0,4,fallback_support
fake product exchanged fraud,0,0,7,refund
no call received from courier,1,1,3,behaviour
one of best delivery,2,2,4,fallback_support
delivery staff rude liar needs training,0,0,3,behaviour
scope for improvement in online KYC verification,1,1,4,fallback_support
delivery marked but receiver different,1,1,4,fallback_support
delivery staff need behaviour training,1,1,3,behaviour
very nice product,2,2,4,fallback_support
sunday dilivery honi chahiye,1,1,4,fallback_support
yes received service,1,1,4,fallback_support
quick service provider deliver on time,1,1,4,fallback_support
incorrect address reported intentionally,1,1,4,fallback_support
delivery guy refuse come up collect downstairs,1,1,4,fallback_support
ok thanks,1,2,4,fallback_support
bad delivery service,0,0,4,fallback_support
long term customer trust appreciated,1,1,4,fallback_support
outstanding service from blue dartgood behavior blue dart agent,2,2,3,behaviour
not at all satisfied,1,1,4,fallback_support
service appreciable,2,2,4,fallback_support
delivery status incorrect no call received,0,0,3,behaviour
extremely rude delivery behaviour,0,0,3,behaviour
delivery boy behaved very rudely and arrogantly,0,0,3,behaviour
pathetic delivery and customer care never recommend,0,0,4,support
self pickup,1,1,4,fallback_support
delivery boy never comes to floor always leaves at ground floor very disappointing,0,0,4,fallback_support
As of now very good experience,2,2,4,fallback_support
product not delivered,0,0,4,fallback_support
no delivered,1,1,4,fallback_support
village delivery slow dissatisfied,0,0,0,delay
On.pay.link,1,1,4,fallback_support
worst delivery service refund demanded,0,0,7,refund
option to choose delivery date required,1,1,4,fallback_support
good service ashwin david thank you,2,2,4,fallback_support
very nice delivery experience,2,2,4,fallback_support
did not receive delivery,0,0,2,damage_lost
delivery delay with no communication,0,0,0,delay
late delivery again,1,0,0,delay
franchise person never delivers at home,0,0,4,fallback_support
order never delivered always marked premise locked,0,0,4,fallback_support
delivery executive very rude behaviour,0,0,3,behaviour
deliver on time without forcing office pickup,1,1,4,fallback_support
delivery status falsely marked delivered,1,1,4,fallback_support
delivery pending,1,1,0,delay
super fast one day delivery polite staff,2,2,4,fallback_support
return requested bad product,0,0,7,refund
wrong item delivered dust instead of product,0,0,4,fallback_support
sharan very kind hard working,2,2,4,fallback_support
packet torn need careful handling,1,1,2,damage_lost
courier person called first day then no follow up false status updated repeatedly,1,1,4,support
atm card not delivered needs branch help,0,0,4,fallback_support
shipment marked delivered but not received,1,1,2,damage_lost
company cheated wrong product sent fraud,0,0,4,fallback_support
excell,1,1,4,fallback_support
awesome,2,2,4,fallback_support
Hg,1,1,4,fallback_support
amit ok,1,1,4,fallback_support
delivery date earlier than expected,1,1,4,fallback_support
package not yet received,0,0,4,fallback_support
delivery speedy smooth,2,2,4,fallback_support
courier delivered to wrong address,0,0,1,wrong_delivery
courier delivered on time thank you,2,2,4,fallback_support
fabric quality very cheap,1,1,4,fallback_support
otp based delivery safe and secure,2,2,4,fallback_support
nil feedback,1,1,6,pricing
delivery boy refused area delivery,0,0,4,fallback_support
great timely delivery,2,2,4,fallback_support
very good product value,2,2,4,fallback_support
video kyc improvement suggestion,1,1,4,fallback_support
unable to track package location,1,1,5,tracking
delay without reason,1,0,0,delay
product not delivered as per convenience,0,0,4,fallback_support
timely,1,1,4,fallback_support
nothing to add,1,1,4,fallback_support
very happy with this courier service,2,2,4,fallback_support
package never delivered false attempts marked,0,0,4,fallback_support
last credit card delivery was very bad,0,0,4,fallback_support
delivery agent never called even after reschedule,1,1,4,support
payment failed due to network issue,0,0,4,fallback_support
wrong information about address marked without OTP or call,0,0,4,support
bad experience ever order not yet deliver but status delivered,0,0,4,fallback_support
relationship manager suggestion for improvement,1,1,4,fallback_support
very pathetic service,0,0,4,fallback_support
delivery person not good,0,0,4,fallback_support
completely satisfied with recent delivery,2,2,4,fallback_support
good h,1,2,4,fallback_support
package roaming with rider no update forced hub pickup,1,1,5,tracking
when get product blue dart parcel tore inside also one of product plastic tore,1,1,4,fallback_support
very satisfied with service,2,2,4,fallback_support
poor service credit card charged without update,0,0,6,pricing
return requested due to size issue,0,0,7,refund
fraud order wrong item sent,0,0,4,fallback_support
false delivery attempt remarks without calling customer,0,0,4,support
fast and secure,2,2,4,fallback_support
parcel expected delivery date missed,1,1,4,fallback_support
delivery handled well polite staff,2,2,4,fallback_support
not delivered to right person,0,0,4,fallback_support
not pure product quality,1,1,4,fallback_support
just keep up good work,2,2,4,fallback_support
can buy pack but get one pack,1,1,4,fallback_support
refund requested,1,0,7,refund
please cancel my order this wrong item,0,0,4,fallback_support
polite behaviour of delivery person,2,2,3,behaviour
please avoid delivery delay,1,0,0,delay
great service on time delivery,2,2,4,fallback_support
delivery pleasant but delayed,1,0,0,delay
not received,1,1,2,damage_lost
shipment falsely marked delivered,0,0,4,fallback_support
third class service,1,1,4,fallback_support
delivery rescheduled falsely,0,0,0,delay
im very happy,2,2,4,fallback_support
delivery call used bluedart address,1,1,4,support
delivery agent unable to reach location despite map and live location,1,1,4,fallback_support
parcel taken back by delivery agent,1,1,4,fallback_support
delivery boy dropped parcel without handover poor practice,0,0,4,fallback_support
want to return product received old item,0,0,7,refund
correct pincode but courier held for three days,0,0,4,fallback_support
loan installment details required,1,1,4,fallback_support
delivery agent behaved rudely while delivering medicine,0,0,3,behaviour
refund process query,1,0,7,refund
ordered pillow received only one,1,1,4,fallback_support
ordered item not sent different item received,1,1,4,fallback_support
delivery agent behaves so rude,0,0,3,behaviour
order falsely marked not available before return,0,0,7,refund
late delivery by one day,1,0,0,delay
service is reliable and good,2,2,4,fallback_support
awsome service from blue dart courier,2,2,4,fallback_support
please deliver faster,1,1,4,fallback_support
delivery boy lied about availability,0,0,4,fallback_support
very delayed delivery not happy,0,0,0,delay
delivered without actual delivery,1,1,4,fallback_support
received image but wrong size delivered,1,0,4,fallback_support
Good banking,2,2,4,fallback_support
very bad behaviour not acceptable,0,0,3,behaviour
item not received,1,1,2,damage_lost
parcel not receive message came delivered,1,1,4,fallback_support
service already good,2,2,4,fallback_support
good quality best service,2,2,4,fallback_support
delivery executive rude handling shipment,0,0,3,behaviour
wrong item delivered by courier boy,0,0,4,fallback_support
delivery delayed without location update,0,0,0,delay
allow delivery at fixed slot,1,1,4,fallback_support
fake product wrong watch received want return,0,0,7,refund
fully satisfied with delivery person,2,2,4,fallback_support
staff behaviour extremely poor at branch,1,1,3,behaviour
very good nice,2,2,4,fallback_support
dress completely different from image want return,0,0,7,refund
payment issue extra amount collected,1,0,6,pricing
delivery poor service,0,0,4,fallback_support
false delivery report despite availability,1,1,4,fallback_support
parcel damaged after multiple follow ups and retaped worst experience,0,0,2,damage_lost
service good,1,2,4,fallback_support
extra money taken beyond order value,0,0,4,fallback_support
order placed by mistake want return,1,1,7,refund
must,1,1,4,fallback_support
bank account opening smooth and hassle free,2,2,4,fallback_support
before arrive please give call,1,1,4,support
call before delivery,1,1,4,support
fraud parcel received instead of original item,0,0,4,fallback_support
delivery agent returned exact change,1,1,7,refund
pathetic service,0,0,4,fallback_support
had to collect from hub after two weeks,0,0,4,fallback_support
package received opened item not missing but seems used earlier,0,0,4,fallback_support
delivery boy behaved badly shouted and did not listen to address instructions,0,0,3,behaviour
name reference,1,1,4,fallback_support
it took extra day for delivery,1,1,4,fallback_support
not in time,1,1,4,fallback_support
mobile cover small size issue,1,0,4,fallback_support
order not delivered suspected fraud,0,0,4,fallback_support
lipstick delivered was empty and used product,0,0,4,fallback_support
order not delivered to me,0,0,4,fallback_support
reliable courier overall,1,1,4,fallback_support
forced to collect from outlet repeatedly,0,0,4,fallback_support
delivery partner did not deliver on time,0,0,4,fallback_support
poor quality name tag,0,0,4,fallback_support
courier not delivered home collected from office,0,0,4,fallback_support
forced hub pickup after fake remarks,0,0,4,fallback_support
size issue and poor quality product,0,0,4,fallback_support
best quality received,1,1,4,fallback_support
delivery without consent unacceptable,1,1,4,fallback_support
used product in package,1,1,4,fallback_support
dont schedule delivery on weekend,1,1,4,fallback_support
excellent service super fast delivery,2,2,4,fallback_support
satisfactory experience,2,2,4,fallback_support
delivery delayed at hub without intimation,0,0,0,delay
delivery executive patient and helpful,2,2,4,fallback_support
no thoughts,1,1,4,fallback_support
product damaged during transport,0,0,2,damage_lost
shipment delivered to different receiver,1,1,4,fallback_support
delivery partner refused to deliver at my address,0,0,4,fallback_support
no doorstep delivery forced self pickup,0,0,4,fallback_support
you serve best,2,2,4,fallback_support
delivery boy did not come to my home address,0,0,4,fallback_support
not delivered to me,0,0,4,fallback_support
it recommend provide order reach owner,1,1,4,fallback_support
delay delivery,1,0,0,delay
card not delivered had to collect from bluedart office staff behaviour bad,0,0,3,behaviour
be honest in first place,1,1,4,fallback_support
behavior very good,2,2,3,behaviour
sir this rong item how can return this not my order,0,0,1,wrong_delivery
very pleased with service,2,2,4,fallback_support
not delivered had to collect parcel personally,1,0,4,fallback_support
didnt receive order,1,1,4,fallback_support
delivery boy contact number should be visible,1,1,4,support
best delivery service ever,2,2,4,fallback_support
delivery delayed need proactive communication,1,0,0,delay
one of best service thank you so much,2,2,4,fallback_support
delay service,1,0,0,delay
too much late delivery,0,0,0,delay
parcel not deliver but message come a deliver,1,1,4,fallback_support
Credit card and online banking facilities should be offered . ,1,1,4,fallback_support
good service good delivery person,2,2,4,fallback_support
consignment not received yet,1,1,2,damage_lost
ordered sunglasses wrong brand delivered,0,0,4,fallback_support
false door closed remark,0,0,4,fallback_support
parcel stuck at hub had to collect myself,0,0,4,fallback_support
humble service,2,2,4,fallback_support
one day delay at patna airport,1,0,0,delay
delivery not completed on time one week delay false incorrect address reasons,0,0,0,delay
no comment,1,1,4,fallback_support
good service first delivery,2,2,4,fallback_support
good working,2,2,4,fallback_support
dont wan,1,1,4,fallback_support
delivery slow and late,1,0,0,delay
forced to pick order from office after delays,0,0,0,delay
product different from website images,1,1,4,fallback_support
just great service,2,2,4,fallback_support
delivery boy extremely poor performance,0,0,4,fallback_support
improve delivery service,1,1,4,fallback_support
damage box little bit open,1,0,2,damage_lost
courier not delivered no call track immediately,0,0,5,tracking
delivery guy very helpful,2,2,4,fallback_support
no call unsure where parcel delivered,0,0,3,behaviour
bank charges slabs not explained clearly before account opening,1,2,4,fallback_support
poor communication high price very late delivery,0,0,0,delay
wrong product delivered,1,0,4,fallback_support
fantastic service packaging very safe,2,2,4,fallback_support
best service experience,2,2,4,fallback_support
package leaked inside but staff fine,1,1,2,damage_lost
