text,sentiment,customer_intent,primary_aspect,aspect_flag
order offer mismatch buy one get one not honoured,1,1,4,fallback_support
delivery delayed disappointed,0,0,0,delay
irrelevant word,1,1,4,fallback_support
blue dart always trustworthy courier,2,2,4,fallback_support
received order,1,1,4,fallback_support
otp verified but parcel not delivered,1,0,4,fallback_support
delivery boy collected money for prepaid order,0,0,4,fallback_support
provide delivery agent contact number when shipment out for delivery,1,1,4,support
always best service,2,2,4,fallback_support
good delivery service,2,2,4,fallback_support
Account opening process is good provide more account types option through online.,2,2,4,fallback_support
prodect exchange by delivery person,1,1,7,refund
delivery boy rude and misbehaved,0,0,3,behaviour
love your service,2,2,4,fallback_support
received wrong order not what I ordered,0,0,4,fallback_support
we not receive parcel,1,1,4,fallback_support
joint account request,1,1,4,fallback_support
timely delivery polite staff,2,2,4,fallback_support
No sir,1,1,4,fallback_support
wrong size received need exchange,1,0,7,refund
oil stain on saree poor quality,0,0,4,fallback_support
order partially delivered missing items,1,0,2,damage_lost
wrong product received no exchange possible,0,0,7,refund
not deliver product,0,0,4,fallback_support
"Nahin 

",1,1,4,fallback_support
parcel reached hub but delivered poorly,0,0,4,fallback_support
rude abusive behaviour,0,0,3,behaviour
too late delivery,1,0,0,delay
color mismatch product,1,1,4,fallback_support
bad service parcel not received but marked delivered,0,0,2,damage_lost
great behaviour,2,2,3,behaviour
quality service,1,1,4,fallback_support
order correct but product fake delivery partner polite,1,1,4,fallback_support
it poor service,0,0,4,fallback_support
return product issue not resolved,0,0,7,refund
always late delivery not delivered at my location,0,0,0,delay
urgent consignment delivered late,1,0,0,delay
delivery not done,1,1,4,fallback_support
package intact,2,2,4,fallback_support
delivery timing coordination appreciated,1,1,4,fallback_support
very good behaviour,2,2,3,behaviour
during face to face delivery please talk politely with customer,1,1,4,fallback_support
address marked incorrect without confirmation,1,1,4,fallback_support
receive wrong product,0,0,4,fallback_support
delivery person update address not contactable,0,0,4,support
parcel received late,0,0,0,delay
didnt get my delivery yet,0,0,4,fallback_support
very fast efficient delivery,2,2,4,fallback_support
delivery facility very poor order misplaced,0,0,4,fallback_support
out for delivery as expected,1,1,4,fallback_support
delivery partner contact details needed,1,1,4,support
fine,1,1,4,fallback_support
share customer executive contact details,1,1,4,support
disappointed service,0,0,4,fallback_support
support team resolved issue quickly,2,0,4,support
bad service ever,0,0,4,fallback_support
no delivery service available had to collect personally,1,1,4,fallback_support
employee behaviour very good,2,2,3,behaviour
delivery person collected extra money,0,0,4,fallback_support
keep going great work,2,2,4,fallback_support
thanks for before time delivery,2,2,4,fallback_support
timely delivery polite delivery person,1,1,4,fallback_support
please deliver to my home address not nearby shop,1,1,4,fallback_support
delivery staff good but issue out of delivery msg come at pm order deliver at pm,1,0,4,fallback_support
delivery agent called appreciated,2,2,4,support
very good delivery boy,2,2,4,fallback_support
blue dart service always perfect,2,2,4,fallback_support
delivery after many days unacceptable delay,0,0,0,delay
yes,1,1,4,fallback_support
another order pending,1,1,4,fallback_support
NRO account not working for weeks unable to transfer money unclear process,0,0,4,fallback_support
blue dart always best,2,2,4,fallback_support
no responsible office staff,1,1,4,fallback_support
perfect,2,2,4,fallback_support
fantastic person,2,2,4,fallback_support
delivery partner waited due to customer delay,1,0,0,delay
delivery call handling poor,1,1,4,support
order incomplete received missing items,0,0,2,damage_lost
order delivery unreliable marked yesterday delivered today,0,0,4,fallback_support
please change my parsal,1,1,4,fallback_support
late service unacceptable delay,1,0,0,delay
didnt order this never placed order,0,0,4,fallback_support
worst company had to collect from office,0,0,4,fallback_support
didnt receive delivery very bad experience,0,0,4,fallback_support
do good,2,2,4,fallback_support
location information message,1,1,4,fallback_support
super person delivery,1,1,4,fallback_support
loan roi mis-selling complaint,0,0,4,support
super fast delivery,2,2,4,fallback_support
service excellent thanks delivery staff,2,2,4,fallback_support
wrong item given after otp,0,0,4,fallback_support
on time delivery good performance,2,2,4,fallback_support
smooth delivery,1,2,4,fallback_support
nice delivery service,2,2,4,fallback_support
please correct my name,1,1,4,fallback_support
overall smooth banking experience helpful staff,2,2,4,fallback_support
gentle man doorstep delivery,1,1,4,fallback_support
return product quality bad,1,0,7,refund
in my opinion,1,1,4,fallback_support
fast delivery good support,2,2,4,support
ordered white received black,1,1,4,fallback_support
service as per plan,1,1,4,fallback_support
service on time and good,2,2,4,fallback_support
rahul very professional as usual,2,2,4,fallback_support
received on scheduled time thank you,2,2,4,fallback_support
day deliver,1,1,4,fallback_support
delivery rules violated forced pickup from hub,0,0,0,delay
ohutdf,1,1,4,fallback_support
not deliver at mentioned address had to collect elsewhere,0,0,4,fallback_support
nice experience,2,2,4,fallback_support
wrong parcel delivered,0,0,4,fallback_support
bluedart delivering fraudulent products serious warning,0,0,4,fallback_support
professionalism,1,1,4,fallback_support
otp shared but parcel not received,0,0,2,damage_lost
need OTP system for delivery,1,1,4,fallback_support
fast good service,2,2,4,fallback_support
havent received order yet,0,0,4,fallback_support
request for credit card information,1,1,4,fallback_support
wrong product scam,0,0,4,fallback_support
good bank,2,2,4,fallback_support
delivery guy refused cancelled delivery,0,0,4,fallback_support
parcel late by day,1,0,0,delay
delivery marked without attempt,0,0,4,fallback_support
delay with false tracking info,1,0,0,delay
wel behave,1,1,4,fallback_support
product not delivered to me,0,0,4,fallback_support
bahot achha hai,1,1,4,fallback_support
never received call delivery not done,0,0,2,damage_lost
did not receive any parcel,0,0,2,damage_lost
wrong product sent want refund,0,0,7,refund
day late delivery always delayed,0,0,0,delay
go collect my own parcel they didnt even deliver after arrive two day before,0,0,4,fallback_support
delivery person very rude no civic sense,0,0,3,behaviour
wrong order received selfie stick replaced,1,0,4,fallback_support
abusive language product changed,1,1,4,fallback_support
delivery call before dispatch requested,1,1,4,support
pre diwali false delivery messages forced self pickup,0,0,4,fallback_support
very bad delayed delivery,0,0,0,delay
courier charges too high unfair,0,0,4,fallback_support
Excellent service and this is my first bank account in my career,2,2,4,fallback_support
not yet receive my parcel,1,1,4,fallback_support
delivery partner not supportive and wrong delivery,0,0,4,support
service commitment only words not action,1,1,4,fallback_support
very bad service no one responsible for shipment,0,0,4,fallback_support
office delivery failed despite prominent location,0,0,0,delay
wrong colour and size received,0,0,4,fallback_support
delivery returned by partner without reason,0,0,7,refund
excellent service by delivery partner,2,2,4,fallback_support
good logistics service no further comment,2,2,4,fallback_support
delivery staff rude not reached location,0,0,3,behaviour
Please open more branches at least one branch in every district,1,1,4,fallback_support
fraud shipper fake product issue,0,0,4,fallback_support
please collect alternate mobile number during booking,1,1,4,fallback_support
parcel not received but marked delivered,0,0,2,damage_lost
best service also really commendable thank you,2,2,4,fallback_support
extreme delivery delay,0,0,0,delay
plant damaged due to poor packing,1,0,2,damage_lost
very bad de,0,0,4,fallback_support
no grievance,1,1,4,support
status delivered but parcel not received,0,0,2,damage_lost
please deliver on time,1,1,4,fallback_support
parcel left at shop without delivery attempt,1,1,4,fallback_support
check your calls,1,1,4,support
packaging acceptable,1,1,4,fallback_support
pathetic experience but not abusive,1,1,4,fallback_support
very polite experienced delivery person,2,2,4,fallback_support
delivery service good,2,2,4,fallback_support
false delivery update rude supervisor behavior,0,0,3,behaviour
order not received yet,0,0,2,damage_lost
delivery updates should be frequent,1,1,4,fallback_support
delivery executive polite made my day,1,1,4,fallback_support
carton slightly damaged,1,0,2,damage_lost
delivery time incorrect,0,0,4,fallback_support
dont like service,0,0,4,fallback_support
delivery executive did not attempt delivery for days and marked false reasons,0,0,4,fallback_support
debit card not received overall banking experience good,2,2,2,damage_lost
it good delivery fast and safe,2,2,4,fallback_support
delivery boy calm nd vry humble im not able pick call still he deliver itom without any contact he find location that amaze so great experience,2,2,4,support
good bank account opening experience,2,2,4,fallback_support
transparent packaging requested,1,1,4,fallback_support
contact mentioned incorrect invoice issue,1,0,4,support
it not deliver medelivered wrong person,0,0,4,fallback_support
keep it up good work,2,2,4,fallback_support
product different from images shown,1,1,4,fallback_support
parcel came empty want refund,0,0,7,refund
delivery partner arrogant rude,0,0,3,behaviour
delivery person rude ruined experience,0,0,3,behaviour
pathetic poor service medicine not delivered despite express charge,0,0,4,fallback_support
best service in courier,2,2,4,fallback_support
bohot bekar delivery or bohot time liya h,1,1,4,fallback_support
prompt delivery,2,2,4,fallback_support
shipping sticker torn package opened,1,1,2,damage_lost
product missing and carton re-taped very bad practice,0,0,2,damage_lost
product bilkul bekar aya h mne kya suit mangaya tha or kya aya h bilkul suit alg or salwar plz return kariye,0,0,7,refund
love your agent behaviour,1,1,3,behaviour
marked delivered but not received at home,0,0,2,damage_lost
bekwas mujhe mila hi nahi order phir delivery kaise kar di,0,0,4,fallback_support
professional timely delivery approach,2,2,4,fallback_support
superfast delivery loved the service,2,2,4,fallback_support
delivery man collect money it free,1,1,4,fallback_support
delivery staff non cooperative rude tone,0,0,3,behaviour
cooperative very nice service,2,2,4,fallback_support
very third class service rude staff fake address reasons no home delivery,0,0,3,behaviour
fast account opening process,1,1,4,fallback_support
bad product receive,0,0,4,fallback_support
early delivery very good service,2,2,4,fallback_support
parcel received today,1,1,4,fallback_support
it perfect many thanks,2,2,4,fallback_support
delivery person waited but did not deliver properly,0,0,4,fallback_support
delivery representative rude response,0,0,3,behaviour
return order request,1,1,7,refund
courier did not deliver my shipment on time,0,0,4,fallback_support
received different product than ordered,0,0,4,fallback_support
delivery boy lazy forced office pickup unacceptable excuse,0,0,4,fallback_support
good service by delivery executive,2,2,4,fallback_support
delivery agent abusive language,0,0,4,fallback_support
received before expected delivery date,1,1,4,fallback_support
bank staff provided very good service,2,2,4,fallback_support
delivery time improvement required,1,1,4,fallback_support
ordered something else received something else,0,0,4,fallback_support
parcel arrived damaged,0,0,2,damage_lost
branch promised wealth account but did not deliver commitment poor experience,1,1,4,fallback_support
try faster delivery for critical shipments,1,1,4,fallback_support
delivery agent ignored instructions handed to security,0,0,4,fallback_support
wrong colour product received,1,0,4,fallback_support
service fine continue,1,1,4,fallback_support
did not receive one of two packages,0,0,2,damage_lost
bad and rough delivery,0,0,4,fallback_support
received message for order I never booked,0,0,4,fallback_support
worst service,0,0,4,fallback_support
request faster delivery time,1,1,4,fallback_support
delivery marked unavailable without call repeated issue,1,0,4,support
late delivery with false updates,0,0,0,delay
fast service but average experience,1,1,4,fallback_support
delivered in one day thank you,2,2,4,fallback_support
very poor experience,1,1,4,fallback_support
defected pc nikla,1,1,4,fallback_support
delivery boy sandeep rude behaviour,0,0,3,behaviour
delivery man abused refused to come upstairs,0,0,3,behaviour
havent receive my order,0,0,4,fallback_support
service ok,1,1,4,fallback_support
welcome kit sent to wrong address delay,1,0,1,wrong_delivery
material fraud issue reported,1,0,4,fallback_support
rude behaviour by delivery partner,0,0,3,behaviour
medicine order delay by day no communication that order delay,0,0,0,delay
service best staff helpful,2,2,4,fallback_support
hello,1,1,4,fallback_support
multiple delivery attempts without calling forced self pickup,0,0,4,support
delivery person have pleasant smile on his face which please see,2,2,4,fallback_support
delivery guy didnt deliver doorstep keep haggle come away from home also rude while talk,0,0,3,behaviour
had to go collect parcel,0,0,4,fallback_support
delivery partner could not reach address asked to pick courier from far location very poor service,0,0,4,fallback_support
bad delivery company,0,0,4,fallback_support
delivery agent stopped km before address,0,0,4,fallback_support
very good product,2,2,4,fallback_support
item not received yet,1,1,2,damage_lost
delivery partner very good,2,2,4,fallback_support
delivery person call confirm address,1,1,4,support
bad experience seal already open,0,0,4,fallback_support
my parcel arrived at blue dart store in november,1,1,4,fallback_support
delivery person rude left parcel,0,0,3,behaviour
bad experience order not received,0,0,2,damage_lost
shipment not delivered yet very important,1,0,0,delay
product missing,1,0,2,damage_lost
no additional comments,1,1,4,fallback_support
not doorstep delivery,0,0,4,fallback_support
wrong product material received used item after many follow ups,0,0,4,support
delivery boy took extra money,1,1,4,fallback_support
not received personally,0,0,2,damage_lost
delivery agent behaviour rude and impatient,0,0,3,behaviour
delivery speed worse than others,0,0,4,fallback_support
scamming people,0,0,4,fallback_support
blue dart courier service very bad and delayed,0,0,0,delay
delivery staff left parcel at security without verification,0,0,4,fallback_support
late delivery,1,0,0,delay
it very very bad experience with your coimbatore hubwhatever happen not first time similar incident take place four time so faryour delivery guy useless always give false reason for not deliver in this case they mention a address incomplete not correcti force collect from officeno proper response from your office at coimbatoreif this status of your delivery system,0,0,4,fallback_support
my name malini patel,1,1,4,fallback_support
delivery staff very good,2,2,4,fallback_support
blue dart delivery very poor product not delivered,0,0,4,fallback_support
everything good satisfied,2,2,4,fallback_support
delay reason address incorrect unacceptable,0,0,0,delay
polite prompt delivery person,1,1,4,fallback_support
iam not person,1,1,4,fallback_support
pathetic branch service,0,0,4,fallback_support
customer care and bank staff very friendly and helpful,2,2,4,support
false delivery attempts no call made,0,0,3,behaviour
always a pleasure,2,2,4,fallback_support
card otp taken but card not delivered,0,0,4,fallback_support
No changes required,1,1,4,fallback_support
very bad delivery no response from delivery boy,0,0,4,support
complaint against rude delivery rider,0,0,3,behaviour
please share delivery timing contact detail of delivery person,1,1,4,support
quick prompt follow up,2,2,4,support
poor service rude behaviour and wrong address delivery,1,0,1,wrong_delivery
excellent customer service always reliable,2,2,4,support
overall excellent service,2,2,4,fallback_support
bad quality,0,0,4,fallback_support
would like report issue regard my recent delivery delivery boy do not deliver order on time also provide incorrect information his officesystem regard delivery status,0,0,4,fallback_support
delivery before promised time appreciated,1,1,4,fallback_support
order dropped kilometers away and doorstep delivery denied rude behavior on call,0,0,3,behaviour
very poor service overall,0,0,4,fallback_support
devendra singh,1,1,4,fallback_support
very bad experience delayed delivery and very rude executive,0,0,0,delay
accha hai,1,1,4,fallback_support
delivery agent asked to collect from office,1,1,4,fallback_support
very good satisfy,2,2,4,fallback_support
very rude and uncooperative delivery agent shouted,0,0,3,behaviour
need more details,1,1,4,fallback_support
amazing order experience,2,2,4,fallback_support
do,1,1,4,fallback_support
delivery not attempted had to visit office,1,1,0,delay
delivery agent did not call falsely marked unavailable,1,1,3,behaviour
received wrong sunglass,1,0,4,fallback_support
delivery guy not polite,0,0,3,behaviour
wrong product delivered theft suspected,1,0,4,fallback_support
very good packaging and timing,2,2,4,fallback_support
still not received item,0,0,2,damage_lost
satyam kumar,1,1,4,fallback_support
attitude problem with delivery staff,1,0,4,fallback_support
"The survey link to provide feedback on opening the account has been sent even before the account being opened.

Inordinate delay in opening the account, while the online opening happened within few minutes.

",1,0,0,delay
service bed,1,1,4,fallback_support
very happy with service thank you,2,2,4,fallback_support
my parcel not delivered,0,0,4,fallback_support
track info not update properly,0,0,5,tracking
asked for full payment without change and behaved rudely,0,0,3,behaviour
no alternative contact used ivr flagged spam parcel delayed,0,0,0,delay
delivery boy not good,0,0,4,fallback_support
wrong item ordered,0,0,4,fallback_support
rude delivery behaviour late hub delivery,0,0,0,delay
no contact forced pickup,1,0,4,support
deliveey agent very good,2,2,4,fallback_support
excellent courier service best shipment,2,2,4,fallback_support
received different product than ordered,1,1,4,fallback_support
nothing to say,1,1,4,fallback_support
not bad,2,0,4,fallback_support
wrong envelope delivered,1,0,4,fallback_support
delivery guy helped despite address issue,2,0,4,fallback_support
package out for delivery but stayed at facility,1,1,4,fallback_support
did not get shipment,0,0,4,fallback_support
super service,2,2,4,fallback_support
delivered at security gate,1,1,4,fallback_support
Hey,1,1,4,fallback_support
please share approximate delivery time in message,1,1,4,fallback_support
bluedart service always up to mark,1,1,4,fallback_support
delivery person behave very nicely,2,2,4,fallback_support
size too small poor quality dress,0,0,4,fallback_support
delivery perfectly before time,2,2,4,fallback_support
colour changed bad,0,0,4,fallback_support
poor service delayed delivery,0,0,0,delay
delivery boy arrogant behaviour,0,0,3,behaviour
thank you for speedy delivery,2,2,4,fallback_support
firstly product arrive kollam pincode error message appear this badly affect delivery date,0,0,4,fallback_support
poor delivery manpower false customer unavailable status,0,0,4,fallback_support
did not deliver doorstep stopped at park,1,1,4,fallback_support
dont take parcel if you cant deliver,0,0,4,fallback_support
delivery boy refused doorstep delivery gave wrong product,1,0,4,fallback_support
poor product quality,0,0,4,fallback_support
delivery smooth and prompt,1,2,4,fallback_support
delivery agent refused to open and verify product behaved rudely shipment incomplete,0,0,3,behaviour
delivery boy was very good,2,2,4,fallback_support
no intimation no contact very pathetic service,0,0,3,behaviour
accurate timely safe delivery,1,1,4,fallback_support
please call after visit,1,1,4,support
order wrong item delivered,0,0,4,fallback_support
delivery time prior intimation suggested,2,2,4,fallback_support
order not received,1,1,2,damage_lost
delivery agent handed parcel to watchman without informing,1,1,4,fallback_support
product out for delivery on expected date,1,1,4,fallback_support
too late delivery unacceptable,0,0,0,delay
asked for delivery message unnecessarily,1,1,4,fallback_support
blue dart favourite highly recommended,2,2,4,fallback_support
osam,1,1,4,fallback_support
seamless banking process zero balance and app improvement suggestion,1,1,4,fallback_support
exchange requested not satisfied,1,1,7,refund
order yet to be delivered,1,1,4,fallback_support
package not delivered,0,0,4,fallback_support
nice experience,1,2,4,fallback_support
site report that delivery center,1,1,4,fallback_support
fast reliable service,2,2,4,fallback_support
very bad experience,0,0,4,fallback_support
forced to collect parcel due to lack of transport at neelambur office repeated false updates unacceptable service,0,0,4,fallback_support
address delivery failed network issue poor service,0,0,0,delay
prompt polite delivery appreciated,2,2,4,fallback_support
different product received scam,0,0,4,fallback_support
address incorrectly marked despite successful past deliveries,1,1,4,fallback_support
delivery delay and rude staff behaviour,0,0,0,delay
courier boy not talk,1,1,4,fallback_support
premium service expectation not met,1,1,4,fallback_support
still not received very bad service,0,0,2,damage_lost
worst courier service in surat,0,0,4,fallback_support
late delivery very rd class service delivery not door door service delivery boy say take your parcel near by location not deliver at adress,0,0,0,delay
I have not received this parcel but it shows that I have received it,1,1,2,damage_lost
not satisfied customer care not responding,0,0,4,support
parcel already reached city but not delivered,1,0,4,fallback_support
delivery person handed product to someone else,0,0,4,fallback_support
Communication with customer is not good in kothapet branch ,0,0,4,fallback_support
received parcel on time,1,1,4,fallback_support
false consignee unavailable status updated without contact forced office pickup,0,0,4,support
delivery took too much time,1,1,4,fallback_support
forced self pickup despite paying delivery charges,0,0,4,fallback_support
fast service hdfc bank,1,1,4,fallback_support
dilivery boy nahi aana chahte hain bolte hain galat pin code hai aapka lekin aisa nahi haihamesa kosis karte hain otp mangne ka or order cancel kar dete hain lekin ish baar mai bahut samjhai tab ja kar aaye or phir bahana bana rahe please consider this problem,1,0,4,fallback_support
do not want this,1,1,4,fallback_support
did not get parcel,0,0,4,fallback_support
very bed service,1,1,4,fallback_support
prediction date not accurate but service good,2,2,4,fallback_support
good performance,2,2,4,fallback_support
on time good delivery,2,2,4,fallback_support
return parcel bad smell,0,0,7,refund
delivered to landmark instead of address,1,1,4,fallback_support
need delivery person contact number,1,1,4,support
material poor need return,0,0,7,refund
well mannered behaviour,1,1,3,behaviour
order parcel of r while order pay r but at time of delivery he ask r deny for pay but he say that then cancel your order not deliver your order,0,0,4,fallback_support
courier boy rude behaviour unacceptable,0,0,3,behaviour
excellent delivery happy to receive this shipment,2,2,4,fallback_support
card delivery failed and marked delivered,0,0,0,delay
prepaid order marked delivered but not received agent unreachable,0,0,2,damage_lost
very pleased parcel arrived safe,2,2,4,fallback_support
get msg that it deliver today morning but get product by pm,0,0,4,fallback_support
delivery boy lacks manners,1,1,4,fallback_support
quality mismatch from images,0,0,4,fallback_support
good keep it up,2,2,4,fallback_support
order not delivered,0,0,4,fallback_support
consignment not delivered but status shows delivered,1,0,5,tracking
shipment not received yet,0,0,2,damage_lost
your service is very good,2,2,4,fallback_support
pickup and dispatch too slow,0,0,4,fallback_support
excellent delivery experience,2,2,4,fallback_support
delivery agent falsely marked not available,0,0,4,fallback_support
packet stuck at center since Wednesday,1,1,4,fallback_support
fake item received,1,1,4,fallback_support
very nice service,2,2,4,fallback_support
overall good but need agent phone number in advance,1,2,4,fallback_support
wrong product delivered fake item,0,0,4,fallback_support
not yet delivered,1,1,4,fallback_support
delayed four days collected from store,0,0,0,delay
try delivering at correct address,1,1,4,fallback_support
delivery refused to come upstairs,1,1,4,fallback_support
please inform at least one hour before delivery,1,1,4,fallback_support
delivery not make at give address even without call reach at address status be show that consignee not available once call make receive parcel from store come store receive parcel bad service,0,0,4,support
delivery marked out but never arrived,0,0,4,fallback_support
need delivery agent contact number,1,1,4,support
shipment not delivered had to collect personally,1,0,4,fallback_support
nice experience overall,2,2,4,fallback_support
delivery complete shown but not received,1,1,2,damage_lost
